{
	"$schema": "https://json-schema.org/draft/2020-12/schema",
	"$id": "https://ue-shed.dev/contracts/cameras/render/v1/session-request.schema.json",
	"type": "object",
	"properties": {
		"contract": {
			"type": "object",
			"properties": {
				"name": {
					"type": "string",
					"enum": ["ue-shed-camera-render"]
				},
				"version": {
					"type": "object",
					"properties": {
						"major": {
							"type": "number",
							"enum": [1]
						},
						"minor": {
							"type": "number",
							"enum": [0]
						}
					},
					"required": ["major", "minor"],
					"additionalProperties": false
				}
			},
			"required": ["name", "version"],
			"additionalProperties": false
		},
		"sessionId": {
			"type": "string",
			"pattern": "^[A-Za-z0-9][A-Za-z0-9._-]{0,127}$"
		},
		"expectedMapPath": {
			"type": "string",
			"maxLength": 1024
		},
		"expectedProjectName": {
			"type": "string",
			"minLength": 1,
			"maxLength": 1024
		},
		"policy": {
			"type": "object",
			"properties": {
				"visibility": {
					"type": "object",
					"properties": {
						"hide": {
							"type": "array",
							"items": {
								"type": "object",
								"properties": {
									"locator": {
										"anyOf": [
											{
												"type": "object",
												"properties": {
													"kind": {
														"type": "string",
														"enum": ["actor_path"]
													},
													"actorPath": {
														"type": "string",
														"pattern": "^\\/Game\\/",
														"maxLength": 4096
													}
												},
												"required": ["kind", "actorPath"],
												"additionalProperties": false
											},
											{
												"type": "object",
												"properties": {
													"kind": {
														"type": "string",
														"enum": ["actor_guid"]
													},
													"actorGuid": {
														"type": "string"
													},
													"lastKnownActorPath": {
														"type": "string",
														"maxLength": 4096
													}
												},
												"required": [
													"kind",
													"actorGuid",
													"lastKnownActorPath"
												],
												"additionalProperties": false
											}
										]
									},
									"label": {
										"type": "string",
										"maxLength": 256
									}
								},
								"required": ["locator", "label"],
								"additionalProperties": false
							},
							"maxItems": 256
						},
						"protect": {
							"type": "array",
							"items": {
								"type": "object",
								"properties": {
									"locator": {
										"anyOf": [
											{
												"type": "object",
												"properties": {
													"kind": {
														"type": "string",
														"enum": ["actor_path"]
													},
													"actorPath": {
														"type": "string",
														"pattern": "^\\/Game\\/",
														"maxLength": 4096
													}
												},
												"required": ["kind", "actorPath"],
												"additionalProperties": false
											},
											{
												"type": "object",
												"properties": {
													"kind": {
														"type": "string",
														"enum": ["actor_guid"]
													},
													"actorGuid": {
														"type": "string"
													},
													"lastKnownActorPath": {
														"type": "string",
														"maxLength": 4096
													}
												},
												"required": [
													"kind",
													"actorGuid",
													"lastKnownActorPath"
												],
												"additionalProperties": false
											}
										]
									},
									"label": {
										"type": "string",
										"maxLength": 256
									}
								},
								"required": ["locator", "label"],
								"additionalProperties": false
							},
							"maxItems": 256
						}
					},
					"required": ["hide", "protect"],
					"additionalProperties": false
				},
				"renderer": {
					"anyOf": [
						{
							"type": "object",
							"properties": {
								"kind": {
									"type": "string",
									"enum": ["editor_viewport"]
								},
								"strategy": {
									"type": "string",
									"enum": ["high_resolution_screenshot"]
								},
								"profile": {
									"type": "string",
									"enum": ["lit", "observation"]
								},
								"vignette": {
									"type": "string",
									"enum": ["project", "disabled"]
								},
								"fog": {
									"type": "boolean"
								},
								"volumetricFog": {
									"type": "boolean"
								},
								"editorPreviews": {
									"type": "boolean"
								},
								"screenshotWarmupFrames": {
									"type": "integer",
									"minimum": 1,
									"maximum": 256
								}
							},
							"required": [
								"kind",
								"strategy",
								"profile",
								"vignette",
								"fog",
								"volumetricFog"
							],
							"additionalProperties": false
						},
						{
							"type": "object",
							"properties": {
								"kind": {
									"type": "string",
									"enum": ["scene_capture"]
								},
								"profile": {
									"type": "string",
									"enum": [
										"full_fidelity",
										"seam_stable",
										"scene_capture_defaults",
										"observation"
									]
								},
								"lodDistanceScale": {
									"type": "number",
									"minimum": 0.1,
									"maximum": 100
								},
								"fog": {
									"type": "boolean"
								},
								"volumetricFog": {
									"type": "boolean"
								},
								"editorPreviews": {
									"type": "boolean"
								}
							},
							"required": [
								"kind",
								"profile",
								"lodDistanceScale",
								"fog",
								"volumetricFog"
							],
							"additionalProperties": false
						}
					]
				},
				"exposure": {
					"anyOf": [
						{
							"type": "object",
							"properties": {
								"mode": {
									"type": "string",
									"enum": ["project_auto"]
								}
							},
							"required": ["mode"],
							"additionalProperties": false
						},
						{
							"type": "object",
							"properties": {
								"mode": {
									"type": "string",
									"enum": ["fixed_ev100"]
								},
								"ev100": {
									"type": "number",
									"minimum": -20,
									"maximum": 30
								},
								"compensation": {
									"type": "string",
									"enum": ["project"]
								}
							},
							"required": ["mode", "ev100", "compensation"],
							"additionalProperties": false
						},
						{
							"type": "object",
							"properties": {
								"mode": {
									"type": "string",
									"enum": ["meter_once"]
								},
								"referenceCamera": {
									"type": "object",
									"properties": {
										"location": {
											"type": "object",
											"properties": {
												"x": {
													"type": "number"
												},
												"y": {
													"type": "number"
												},
												"z": {
													"type": "number"
												}
											},
											"required": ["x", "y", "z"],
											"additionalProperties": false
										},
										"rotation": {
											"type": "object",
											"properties": {
												"pitch": {
													"type": "number"
												},
												"roll": {
													"type": "number"
												},
												"yaw": {
													"type": "number"
												}
											},
											"required": ["pitch", "roll", "yaw"],
											"additionalProperties": false
										},
										"projection": {
											"anyOf": [
												{
													"type": "object",
													"properties": {
														"kind": {
															"type": "string",
															"enum": ["perspective"]
														},
														"horizontalFieldOfView": {
															"type": "number",
															"minimum": 5,
															"maximum": 170
														}
													},
													"required": ["kind", "horizontalFieldOfView"],
													"additionalProperties": false
												},
												{
													"type": "object",
													"properties": {
														"kind": {
															"type": "string",
															"enum": ["orthographic"]
														},
														"width": {
															"type": "number",
															"exclusiveMinimum": 0,
															"maximum": 1000000000
														}
													},
													"required": ["kind", "width"],
													"additionalProperties": false
												}
											]
										}
									},
									"required": ["location", "rotation", "projection"],
									"additionalProperties": false
								},
								"referenceSize": {
									"type": "object",
									"properties": {
										"width": {
											"type": "integer",
											"minimum": 16,
											"maximum": 16384
										},
										"height": {
											"type": "integer",
											"minimum": 16,
											"maximum": 16384
										}
									},
									"required": ["width", "height"],
									"additionalProperties": false
								},
								"minimumFrames": {
									"type": "integer",
									"minimum": 1,
									"maximum": 4096
								}
							},
							"required": [
								"mode",
								"referenceCamera",
								"referenceSize",
								"minimumFrames"
							],
							"additionalProperties": false
						}
					]
				},
				"settling": {
					"type": "object",
					"properties": {
						"minimumFrames": {
							"type": "integer",
							"minimum": 1,
							"maximum": 4096
						},
						"timeoutMs": {
							"type": "integer",
							"minimum": 1000,
							"maximum": 900000
						},
						"initialView": {
							"type": "object",
							"properties": {
								"camera": {
									"type": "object",
									"properties": {
										"location": {
											"type": "object",
											"properties": {
												"x": {
													"type": "number"
												},
												"y": {
													"type": "number"
												},
												"z": {
													"type": "number"
												}
											},
											"required": ["x", "y", "z"],
											"additionalProperties": false
										},
										"rotation": {
											"type": "object",
											"properties": {
												"pitch": {
													"type": "number"
												},
												"roll": {
													"type": "number"
												},
												"yaw": {
													"type": "number"
												}
											},
											"required": ["pitch", "roll", "yaw"],
											"additionalProperties": false
										},
										"projection": {
											"anyOf": [
												{
													"type": "object",
													"properties": {
														"kind": {
															"type": "string",
															"enum": ["perspective"]
														},
														"horizontalFieldOfView": {
															"type": "number",
															"minimum": 5,
															"maximum": 170
														}
													},
													"required": ["kind", "horizontalFieldOfView"],
													"additionalProperties": false
												},
												{
													"type": "object",
													"properties": {
														"kind": {
															"type": "string",
															"enum": ["orthographic"]
														},
														"width": {
															"type": "number",
															"exclusiveMinimum": 0,
															"maximum": 1000000000
														}
													},
													"required": ["kind", "width"],
													"additionalProperties": false
												}
											]
										}
									},
									"required": ["location", "rotation", "projection"],
									"additionalProperties": false
								},
								"size": {
									"type": "object",
									"properties": {
										"width": {
											"type": "integer",
											"minimum": 16,
											"maximum": 16384
										},
										"height": {
											"type": "integer",
											"minimum": 16,
											"maximum": 16384
										}
									},
									"required": ["width", "height"],
									"additionalProperties": false
								},
								"minimumFrames": {
									"type": "integer",
									"minimum": 1,
									"maximum": 4096
								}
							},
							"required": ["camera", "size", "minimumFrames"],
							"additionalProperties": false
						}
					},
					"required": ["minimumFrames", "timeoutMs"],
					"additionalProperties": false
				},
				"time": {
					"type": "string",
					"enum": ["live_editor", "freeze_materials_and_ticks"]
				},
				"preparation": {
					"type": "object",
					"properties": {
						"geometry": {
							"anyOf": [
								{
									"type": "object",
									"properties": {
										"mode": {
											"type": "string",
											"enum": ["preserve_loading"]
										}
									},
									"required": ["mode"],
									"additionalProperties": false
								},
								{
									"type": "object",
									"properties": {
										"mode": {
											"type": "string",
											"enum": ["camera_regions"]
										},
										"maximumRegions": {
											"type": "integer",
											"minimum": 1,
											"maximum": 64
										},
										"extent": {
											"type": "object",
											"properties": {
												"x": {
													"type": "number",
													"minimum": 0,
													"maximum": 10000000
												},
												"y": {
													"type": "number",
													"minimum": 0,
													"maximum": 10000000
												},
												"z": {
													"type": "number",
													"minimum": 0,
													"maximum": 10000000
												}
											},
											"required": ["x", "y", "z"],
											"additionalProperties": false
										}
									},
									"required": ["mode", "maximumRegions", "extent"],
									"additionalProperties": false
								}
							]
						},
						"dataLayers": {
							"type": "array",
							"items": {
								"type": "object",
								"properties": {
									"assetPath": {
										"type": "string",
										"maxLength": 1024
									},
									"loaded": {
										"type": "boolean"
									},
									"visible": {
										"type": "boolean"
									}
								},
								"required": ["assetPath", "loaded", "visible"],
								"additionalProperties": false
							},
							"maxItems": 64
						}
					},
					"required": ["geometry", "dataLayers"],
					"additionalProperties": false
				}
			},
			"required": ["renderer", "exposure", "settling", "time", "preparation"],
			"additionalProperties": false
		},
		"leaseMs": {
			"type": "integer",
			"minimum": 1000,
			"maximum": 120000
		},
		"maximumFrames": {
			"type": "integer",
			"minimum": 1,
			"maximum": 1000000
		}
	},
	"required": [
		"contract",
		"sessionId",
		"expectedMapPath",
		"expectedProjectName",
		"policy",
		"leaseMs",
		"maximumFrames"
	],
	"additionalProperties": false,
	"$defs": {}
}
