{
	"contract": {
		"name": "ue-shed-camera-render",
		"version": {
			"major": 1,
			"minor": 0
		}
	},
	"sessionId": "fixture-session",
	"expectedMapPath": "/Game/Fixture/Cameras/L_CameraLoad",
	"expectedProjectName": "UEShedFixture",
	"policy": {
		"renderer": {
			"kind": "editor_viewport",
			"strategy": "high_resolution_screenshot",
			"profile": "lit",
			"vignette": "project",
			"fog": true,
			"volumetricFog": true,
			"screenshotWarmupFrames": 128
		},
		"exposure": {
			"mode": "fixed_ev100",
			"ev100": 1,
			"compensation": "project"
		},
		"settling": {
			"minimumFrames": 4,
			"timeoutMs": 120000
		},
		"time": "live_editor",
		"preparation": {
			"geometry": {
				"mode": "preserve_loading"
			},
			"dataLayers": []
		}
	},
	"leaseMs": 120000,
	"maximumFrames": 8
}
